{
  "contract": "judgment_request",
  "version": "v1",
  "request_id": "judgment_request:gc_item_18-remote_workflow_v1b",
  "artifact_id": "gc_item_18",
  "subject": {
    "title": "AI systems",
    "type": "document"
  },
  "context": {
    "source_system": "garbage_collector",
    "source_type": "note",
    "analysis_profile": "remote_workflow_v1b"
  },
  "chunks": [
    {
      "chunk_id": "chunk:gc_item_18-1",
      "text": "AI systems\n\nMemory tool behavior notes.",
      "section_label": "section_1"
    }
  ],
  "evidence": {
    "provenance": {
      "artifact_id": "gc_item_18",
      "chunk_count": 1,
      "lineage": [
        "gc_item_18",
        "chunk:gc_item_18-1"
      ]
    },
    "hash_sha256": "c1ea09930e327a48b1b809a658c087af8d0fa5793bbd5268c8ec29e0adb6849f"
  },
  "metadata": {
    "object_id": "judgment_request:gc_item_18-remote_workflow_v1b",
    "schema_version": "v1",
    "created_at": "2026-03-15T12:15:00Z",
    "updated_at": "2026-03-15T12:15:00Z",
    "source_system": "garbage_collector",
    "pipeline_run_id": "remote_workflow_v1b-case-05",
    "confidence": 1.0,
    "tags": [
      "artifact-lane",
      "judgment-request"
    ],
    "lineage": [
      "gc_item_18",
      "chunk:gc_item_18-1"
    ]
  }
}